{
  "$schema": "https://json-schema.org/draft/2020-12/schema",
  "$id": "https://assent.dev/schemas/decision/v1alpha1/presentation-model.schema.json",
  "title": "PresentationModel",
  "description": "Redacted, renderer-only view of findings/trace (ADR-0016 §3): what templates/explain/report.md consume. Mirrors DecisionRecord's findings exactly (same finding shape, reused by $ref) — no raw fact value (the finding shape has no such field) and no rendered markdown (rendering stays a separate concern, ADR-0016 §4; additionalProperties: false leaves no room for one).",
  "type": "object",
  "additionalProperties": false,
  "required": ["apiVersion", "kind", "decision", "findings"],
  "properties": {
    "apiVersion": { "const": "assent.dev/v1alpha1" },
    "kind": { "const": "PresentationModel" },
    "decision": { "enum": ["APPROVE", "REVIEW", "BLOCK"] },
    "findings": {
      "type": "array",
      "items": { "$ref": "https://assent.dev/schemas/decision/v1alpha1/decision-record.schema.json#/$defs/finding" }
    }
  }
}
